Drive Scanning  On dkw01, Output for /dev/sdc on Mount: /host/system/state: smartctl 7.4 2023-08-01 r5530 [x86_64-linux-6.6.43-talos] (local build)
Copyright (C) 2002-23, Bruce Allen, Christian Franke, www.smartmontools.org

=== START OF INFORMATION SECTION ===
Device Model:     MZ7LH480HBHQ0D3
Serial Number:    S5YJNA0R211542
LU WWN Device Id: 5 002538 e0122f1e6
Add. Product Id:  DELL(tm)
Firmware Version: HG57
User Capacity:    480,103,981,056 bytes [480 GB]
Sector Sizes:     512 bytes logical, 4096 bytes physical
Rotation Rate:    Solid State Device
Form Factor:      2.5 inches
TRIM Command:     Available, deterministic, zeroed
Device is:        Not in smartctl database 7.3/5528
ATA Version is:   ACS-4 T13/BSR INCITS 529 revision 5
SATA Version is:  SATA 3.3, 6.0 Gb/s (current: 6.0 Gb/s)
Local Time is:    Tue Oct 22 07:47:51 2024 UTC
SMART support is: Available - device has SMART capability.
SMART support is: Enabled

=== START OF READ SMART DATA SECTION ===
SMART overall-health self-assessment test result: PASSED

General SMART Values:
Offline data collection status:  (0x00)	Offline data collection activity
					was never started.
					Auto Offline Data Collection: Disabled.
Self-test execution status:      (   0)	The previous self-test routine completed
					without error or no self-test has ever 
					been run.
Total time to complete Offline 
data collection: 		(    0) seconds.
Offline data collection
capabilities: 			 (0x5b) SMART execute Offline immediate.
					Auto Offline data collection on/off support.
					Suspend Offline collection upon new
					command.
					Offline surface scan supported.
					Self-test supported.
					No Conveyance Self-test supported.
					Selective Self-test supported.
SMART capabilities:            (0x0003)	Saves SMART data before entering
					power-saving mode.
					Supports SMART auto save timer.
Error logging capability:        (0x01)	Error logging supported.
					General Purpose Logging supported.
Short self-test routine 
recommended polling time: 	 (   2) minutes.
Extended self-test routine
recommended polling time: 	 (  29) minutes.
SCT capabilities: 	       (0x003d)	SCT Status supported.
					SCT Error Recovery Control supported.
					SCT Feature Control supported.
					SCT Data Table supported.

SMART Attributes Data Structure revision number: 1
Vendor Specific SMART Attributes with Thresholds:
ID# ATTRIBUTE_NAME          FLAG     VALUE WORST THRESH TYPE      UPDATED  WHEN_FAILED RAW_VALUE
  1 Raw_Read_Error_Rate     0x001a   200   200   000    Old_age   Always       -       0
  5 Reallocated_Sector_Ct   0x0033   100   100   010    Pre-fail  Always       -       0
  9 Power_On_Hours          0x0032   094   094   000    Old_age   Always       -       28590
 12 Power_Cycle_Count       0x0032   099   099   000    Old_age   Always       -       98
 13 Read_Soft_Error_Rate    0x001a   200   200   000    Old_age   Always       -       0
177 Wear_Leveling_Count     0x0013   072   072   005    Pre-fail  Always       -       2026
179 Used_Rsvd_Blk_Cnt_Tot   0x0013   100   100   010    Pre-fail  Always       -       0
180 Unused_Rsvd_Blk_Cnt_Tot 0x0012   100   100   000    Old_age   Always       -       1010
181 Program_Fail_Cnt_Total  0x0032   100   100   000    Old_age   Always       -       0
182 Erase_Fail_Count_Total  0x0032   100   100   000    Old_age   Always       -       0
184 End-to-End_Error        0x0033   100   100   097    Pre-fail  Always       -       0
194 Temperature_Celsius     0x0022   069   061   000    Old_age   Always       -       31
195 Hardware_ECC_Recovered  0x001a   100   100   000    Old_age   Always       -       0
198 Offline_Uncorrectable   0x0030   100   100   000    Old_age   Offline      -       0
199 UDMA_CRC_Error_Count    0x003e   100   100   000    Old_age   Always       -       0
201 Unknown_SSD_Attribute   0x0033   100   100   001    Pre-fail  Always       -       0
202 Unknown_SSD_Attribute   0x0033   100   100   010    Pre-fail  Always       -       0
233 Media_Wearout_Indicator 0x0032   099   099   000    Old_age   Always       -       714873669571
235 Unknown_Attribute       0x0012   099   099   000    Old_age   Always       -       93
242 Total_LBAs_Read         0x0032   099   099   000    Old_age   Always       -       94557756056
243 Unknown_Attribute       0x0032   100   100   000    Old_age   Always       -       0
244 Unknown_Attribute       0x0032   100   100   000    Old_age   Always       -       0
245 Unknown_Attribute       0x003a   072   072   000    Old_age   Always       -       72
246 Unknown_Attribute       0x0032   100   100   000    Old_age   Always       -       65535
247 Unknown_Attribute       0x0032   100   100   000    Old_age   Always       -       65535
248 Unknown_Attribute       0x0032   100   100   000    Old_age   Always       -       65535
251 Unknown_Attribute       0x0032   100   100   000    Old_age   Always       -       2168761521536

SMART Error Log Version: 1
No Errors Logged

SMART Self-test log structure revision number 1
Num  Test_Description    Status                  Remaining  LifeTime(hours)  LBA_of_first_error
# 1  Short offline       Completed without error       00%     28590         -
# 2  Short offline       Completed without error       00%     28589         -
# 3  Short offline       Completed without error       00%     28570         -
# 4  Short offline       Completed without error       00%     28302         -
# 5  Extended offline    Completed without error       00%         2         -
# 6  Short offline       Completed without error       00%         1         -

SMART Selective self-test log data structure revision number 1
 SPAN  MIN_LBA  MAX_LBA  CURRENT_TEST_STATUS
    1        0        0  Not_testing
    2        0        0  Not_testing
    3        0        0  Not_testing
    4        0        0  Not_testing
    5        0        0  Not_testing
  256        0    65535  Read_scanning was never started
Selective self-test flags (0x0):
  After scanning selected spans, do NOT read-scan remainder of disk.
If Selective self-test is pending on power-up, resume after 0 minute delay.

The above only provides legacy SMART information - try 'smartctl -x' for more
